{
  "schema_version": "0.1.0",
  "series_id": "weather",
  "time_axis": {
    "kind": "utc",
    "unit": "s",
    "origin": "2024-01-01T00:00:00Z"
  },
  "sampling": "interval_mean",
  "signals": [
    {
      "schema_version": "0.1.0",
      "signal_id": "ghi",
      "model_id": "solar",
      "name": "ghi",
      "data_type": "real",
      "unit": "W/m^2",
      "causality": "input"
    },
    {
      "schema_version": "0.1.0",
      "signal_id": "dni",
      "model_id": "solar",
      "name": "dni",
      "data_type": "real",
      "unit": "W/m^2",
      "causality": "input"
    },
    {
      "schema_version": "0.1.0",
      "signal_id": "dhi",
      "model_id": "solar",
      "name": "dhi",
      "data_type": "real",
      "unit": "W/m^2",
      "causality": "input"
    },
    {
      "schema_version": "0.1.0",
      "signal_id": "temp",
      "model_id": "solar",
      "name": "temp",
      "data_type": "real",
      "unit": "degC",
      "causality": "input"
    }
  ],
  "samples": [
    {
      "time": "2024-01-01T00:00:00Z",
      "end_time": "2024-01-01T01:00:00Z",
      "values": {
        "ghi": {
          "value": 500,
          "status": "valid",
          "diagnostics": []
        },
        "dni": {
          "value": 600,
          "status": "valid",
          "diagnostics": []
        },
        "dhi": {
          "value": 100,
          "status": "valid",
          "diagnostics": []
        },
        "temp": {
          "value": 20,
          "status": "valid",
          "diagnostics": []
        }
      }
    },
    {
      "time": "2024-01-01T01:00:00Z",
      "end_time": "2024-01-01T02:00:00Z",
      "values": {
        "ghi": {
          "value": 500,
          "status": "valid",
          "diagnostics": []
        },
        "dni": {
          "value": 600,
          "status": "valid",
          "diagnostics": []
        },
        "dhi": {
          "value": 100,
          "status": "valid",
          "diagnostics": []
        },
        "temp": {
          "value": 20,
          "status": "valid",
          "diagnostics": []
        }
      }
    }
  ],
  "diagnostics": []
}
